{
  "schema": "sigil.receipt/v2",
  "registration_sha256": "574eb4e8fa4e679b23a4f6efa4e7590697b71778627fa3a5980ce37badb0b830",
  "registered_at": "2026-10-04T21:43:18Z",
  "registry_public_key": "e563b2dec65bf8cda38a88fd355691f3940d6ef7b553e98ad1376e9a75402130",
  "registry_signature": "Nci+HFCTAZxAMTztQUAsA07yZIfrzk+m4MJoDa99+6kK0cGBvokHFqychAGx+Jg/v/bY2lGVAqYsauMeO31uDg=="
}